book_id;review_id;review_rating;sentence;kmeans_label
8595083274;R2OGT6CKYUMUJM;5;É um livro bem completo para quem quer mudar o rumo das finanças pessoais, há muitos livros sobre esse assunto, mas poucos com tanta facilidade de entendimento.;1
8576849941;R2W4VHNJ7B9I3A;4;Ótimo e entrega rápida.;2
8501076252;R36099H6N42Q3;5;Tem momentos que vc tem vontade de matar os personagens...de dar uns tapas neles....;1
8501117684;R38CQTPR0NVUCD;5;Vale a leitura!;0
8535909559;R3NLL5EGZ6ZIC3;5;Me trouxe questionamentos interessantes e me deixou reflexiva tentando analisar o que se aplicava à minha realidade!;1
8501105732;R11XUH0YGJTVYE;5;Medos, traumas, superação...;1
6580309318;R3IKIFOQXJO4ME;5;Uma escrita muito gostosa e fácil de ler.;1
8576849941;R2T3RYTBCQ056P;4;Interessante para quem busca melhores resultados nos diversos campos da vida.;1
8565765482;RJGE8ZSCI1JC5;3;Eu gostei mais verio ameaçado e um pouco danificada a capa;1
8555340896;R37KTP3222721G;5;A qualidade e otima, chegou em cerca de uma semana, não veio com nenhum amassado, e sobre a historia, e incrivel, amo essas duas meninas muito mesmo, o enredo e incrivel, muito recomendado!!;1
8565765695;R3AJWQX6PYF5YS;1;Insisti ate a pagina 100 e finalmente desisti.;1
8576849941;R38YW2W47ZBLGZ;5;Super Recomendo a leitura.;0
8543107202;R38XXZ4SIYCRVS;5;O livro é no mínimo excepcional, leitura simples, mas quebra todo tabu com relação do caminhar da vida para morte.;1
8501076252;RX37BUHTT32JO;5;Foi o livro q eu tive todas as emoções possíveis!;1
6555320516;R3PCIMRHO04QS6;4;Um livro que apresenta, sem melindres, a forma como o ser humano lida com o poder.;1
8551006754;R26LBWVJS2L27A;5;Apesar de serem parecidos, eles possuem pequenas diferenças.;1
8543102146;R2MLWK4116O5BL;2;Li mais ou menos pelo rumo.;0
8565765482;R38XJHLKBISRVP;4;só de pensar nele já começa a me dar um siricutico.;1
8539004119;R1YXGL8AGH2TBB;3;Nos fazer refletir nossos hábitos e organizar melhor nossa rotina!;1
8501112518;R8IPX01B1BVY2;5;Esse foi o meu primeiro livro da colleen hoover e eu sinceramente amei, ela escreve essa história de uma forma muito pessoal, e dá sentir todas as emoções junto com ela, acho que toda mulher deveria ler esse livro.;1
8568014003;ROPIZTSMT8URF;5;Todos os livros do Napoleon Hill tem a mesma mensagem.;1
8575422391;R5PF854W5SP6D;5;O autor propõe muitas formas de pensar e agir, algumas poucas, na minha opinião, fora da realidade do brasileiro, mas cabe ao leitor filtrar e aplicar o que está ao seu alcance.;1
8584440739;R2509RVBC1ME3Z;5;De fácil leitura e ajuda muito no entendimento de uma melhor conversa com a criança;1
8575422391;R3JJVTBG2W2KM;5;Todas as informações e dicas passadas pelo autor nos abre a mente e nos leva ao raciocínio lógico quando se trata de finanças comportamentais.;1
8539004119;RJTURNFL9SXBZ;1;Estou dando uma estrela somente pela péssima tradução, o tema é excelente, mas não recomendo a compra do e-book, talvez o livro esteja melhor nesse quesito.;1
8545202210;R2ECAKFA5K9ZBS;5;A crença  ;3
8555340896;R2RDRNT8FE7PJO;5;Livro com uma escrita fácil e gostosa de ler, com personagens carismáticos que causam muita emoção em quem está lendo.;1
8595084742;R3TVEIL4749W6S;5;Muito bonito o pôster!;0
8595083274;R1FRJJUR3IIAT8;4;Para quem já tem um bom controle de finanças e já investe, o livro pode não trazer muitas novidades.;1
8595084742;R1AIQ2M5C0HPUX;1;Não recebi o poster!;0
8532530788;R6OSA1A1OLBNU;5;Livro muito bom!;0
8501117846;R1OWOIL4BV2CD2;4;Não vou dizer que me decepcionei, mas não gostei muito do desenrolar do livro, tinha muita cena de ...;1
8573258926;R2DOSIAK862Q2B;5;Chegou em excelente estado, e me surpreendeu com a velocidade da entrega, já que eu tinha comprado a meia noite e chegou no mesmo dia no começo da tarde.;2
8595084742;R3CX02IXQ9X01I;4;O Hobbit.;3
8501076252;R1V1EL6P8C84RH;5;assim como todo e qualquer livro da Colleen precisa ser lido...;1
8595083274;R323F34E55GCT2;5;Leitura bem agradável.;0
8501076252;R3UUDWTRU9DWNK;1;Abandonei e deletei da minha lista de leitura esta autora.;1
8595084742;R2HJSOAIQO3X4I;5;Maravilhoso um sonho;0
8595081530;R3KGVOPKAO3479;3;O livro é bacana, aprendi algumas coisas, ele é rápido e fluido porém achei bastante repetitivo, do meio para o final ele somente repetia o que já havia dito com alguns exemplos.;1
8501112518;R2T13ILYBHXHVR;5;Vale a pena ler esse livro;0
8584391401;R1Y6LEQIZX920Y;5;Depois que terminei esse livro percebi que eu deixei passar a genialidade dos outros dois livros que eu já li dela!É muito bom!;1
8543108683;RKLTRFTG29C8V;5;Até minha filha de 14 anos leu e adorou!;1
8535933395;R2RL5CZEHVUGBH;5;Parabéns!;0
8584391509;R2XXIBGNREXADF;5;A narrativa tem um ritmo que te prende e você quer ler tudo numa sentada só.;1
8535909559;R3THXJF8OEIA7S;5;O livro foi entregue super rápido, em perfeito estado!!Todos;2
8542209826;R186TUGDBZOT1K;5;Chegou dento do prazo e em perfeito estado, consegui acompanhar certinho a entrega.;2
8547000240;R3ANTCJXLJPFS3;4;Recomendo.;0
8578601777;RVBBG5BMQOCN0;5;Recomendo!;0
8543107202;R1U4ZVOM48XGKR;5;O livro tem um material muito bom, folhas e capa.;2
8535932879;R2UMGO5EXLS8OU;5;A linguagem utilizada é bem simples e introdutória.;1
8580412382;R3C9ORASGWWO07;5;Sou uma romântica incondicionalAmei o livro.;0
8568014003;R14AHZZIOEA9PC;3;Livro bom, pessoalmente não gosto muito do jeito que o autor contou sua metáfora, mas todas as ideias que ele colocou ali fazem sentido e são muito boas.;1
6555111100;R88HNBEIBEWP5;5;!;3
8575422391;R3LBYDLGM144SS;5;Pretendo ler novamente daqui algum tempo.;1
8575422391;R30LE5YPA0KPDL;5;Nota 1000 livro extraordinário;0
8535909559;R3IRTDFOOURFKT;5;muito bom;0
8508196555;R3MOVYRZ2OIARS;5;Doloroso, mas necessário.;0
8542209826;R1EDVMGLV56YV5;5;Nossa, sem palavras pra descrever tudo o que vivi lendo esse livro, maravilhoso, uma aula de como viver  ;1
8575422391;R3279ZFKHLNTL5;5;Estudar história de pessoas ricas, aprender com quem já está lá, escolher com muito cuidados seus mestres/professores/exemplo, pode-se se o bolo E comer o bolo.;1
8501304468;R25QCCLZ13J5YT;3;Os livros são muito lindos e a história é maravilhosa mostra sobre uma mulher forte e guerreira que não vai parar até conseguir o que  quer  a estória não aborda muito romance então vc que tá esperando romance e melhor procurar outro .Sério perfeito se não fosse pela entrega e pelos erros de digitação o livro da rainha do nada veio danificado em uma das pontas e muitas palavras se espaço classificação de idade para mim 13+  ;1
8545202210;R2M8T3JG1VE7P4;5;Excelente  livro para quem quer se identificar no seu estado atual para iniciar suas mudanças.;1
8543107202;R3OKOJDJIM1GYU;5;Tem que estar com q cabeça aberta e de bom humor pra lê-lo.;1
8595081530;R312QSGNWYH7PO;3;Ótimo livro para crianças, leitura extremamente leve.;0
6555650001;R3GC5ZU7NDWT9I;5;dúvida a Julia Quinn soube como roubar e prender a minha atenção.;1
8546501459;R20ZACB9EES9W8;5;Ótimo, agora é só partir para a leitura.;1
8532649963;R3QX1U7096XL7N;4;O livro é muito bom, porém apesar de curto, consegue ser um livro muito denso.;1
8543105293;R3531CR28E67JX;3;Bonito na teoria, mas praticar algumas das dicas neste mundo neoliberal é quase impossível.;1
8584391509;R27Y5VY8ZQ5HOR;5;Todos os livros que compro aqui, são para minha filha.;1
6555871784;RLQGPV3CXG959;4;As grutas.;3
8532530788;R12Z41G101BFKS;5;mas tudo bem;3
8539004119;R3LYCRK043E9X3;5;MUITO BOM.;0
8595081530;R2G1K927EQQSK0;5;É simplesmente fantástico!;0
8501112518;R3URTQ38UN8V6O;5;Verdade nua e crua?;1
8565765695;R1H1EWGBC1J7DU;2;Chegou rápido mas veio amassado e eu tenho super cuidado,além disso veio faltando páginas!!!!!!;2
8501076252;R1A7X33XOI6JHF;5;Seu eu recomendo a leitura?;0
6555650001;R1YH6ID49YA570;4;E que venha a história de Anthony Bridgerton!;1
8555341612;R2DJ0N9HI7TI3G;5;♡;3
8544106595;R1MLR0MN4XGS0Q;5;O livro chegou rápido,  muito bem embalado,  em excelentes condições!!;2
8594541473;R23UK8EWXQO2EM;5;Amei lindo exatamente como eu imaginei, e essa capa dura pelo preço de livro de capa comum tudo de bom...;1
8573258926;R2TJ6M82UZU1OI;5;Esteja você em crise no seu relacionamento ou não, a leitura desse livro é super recomendada.;1
8576849941;R1423B463AJ634;4;Este livro consegue trazer algumas aplicações praticas, o que ajuda muito a estimular mudanças comportamentais.;1
8551006754;R4ILE5O0K78PP;5;Lindo trabalho feito, capa dura, marcador de página;2
8532530788;R21Q0V8LO7TUYU;5;perfeito!;3
8539004119;RFF75ZSVE8GV0;5;Primeira: ache uma deixa simples e óbvia.;1
8532530788;R3SBAE0KNNM3GM;5;Pelo contrário.;3
8543108683;R1XAH0HEI8BZ3M;5;Amando a leitura.;0
8576849941;R2HFJBW7MKFQTF;4;Este é um daqueles livros categorizados como autoajuda e que realmente podem ajudar as pessoas a terem uma vida mais saudável, a concretizar projetos, a ter uma vida mais plena, próspera e feliz.;1
6555871784;R379OV15S3X4SV;2;As explicações são demasiadas simplistas.;1
8501112518;RFO8G7KVB88Q;5;Fala sobre violência doméstica de uma forma perfeita e muito real.;1
8501117846;R2YRB4UG3KB4G7;5;A história é envolvente, surpreendente e muito bem escrita!;1
8576849941;RFMQVZKPFESZV;5;Foi muito recomendado por isso comprei;0
6555650842;R1EI7IW177NJ1I;4;A estrela que tirei na avaliação, foi por conta de um amassado bem evidente capa do produto.;1
8555340896;R2RX5F8D0B179V;3;Eu gostei, mas não amei (e eu esperava amar e favoritar este livro).;1
8501112518;R11EE0NL65Q6E3;3;O livro começa como todo romance adulto, clichê até eu querer larga-lo, mas como estou fugindo dos meus problemas reais por meio da ficção, prossegui.;1
8535909559;R1WU3GWCELIE7S;5;Nota 10.;0
8501112518;R2K7Q1CA6BKDVI;5;No começo achei o livro um pouco parado demais mas quando você vai lendo, você pega gosto pela historia tão linda e ao mesmo tempo triste da personagem Lily.;1
8568014542;R16AVTXGAQI6U4;5;muito bom;0
8501117846;R2H00JIX1URIJ2;4;Basicamente, vemos uma escritora chamada Lowen ser contratada para terminar de escrever uma série famosa de uma autora de sucesso, Verity, pois ela sofreu um acidente e as sequelas deixadas por ele a impedem de continuá-la.;1
8595083274;R8L51T0FU5YBH;5;Muito bom para quem entende pouco do assunto.;1
8543102146;R1WG6TGFVJPUTE;5;Com ele pude aprender a importância de dizer NÃO para as coisas.;1
8584391673;RA9JZXUQJHSEU;4;Depois ela trabalha como Emma tenta se recompor e se apaixona por Sam e depois vem a parte onde agora estão os três nessa equação.;1
8550807567;RF5P9Z30YTEYF;4;Aprovado.;0
8551006754;R3CQTQS4H8IG80;5;Chegou perfeito e antes do prazo, com outras compras.;2
8595083274;RLDQXX69DPGMC;5;Ótimo livro para quem quer começar seus investimentos e começar a mudança de vida!;1
8574069051;R106O2HQQI6CF5;5;Meu filho tem dois anos e ama esse livro!;1
8595081514;RHRH70BYC6QGV;5;O livro pode parecer de crianças, mas serve todos os públicos, é um livro universal, que todo leitor deveria ler pelo menos uma vez na vida.;1
8594541473;R2TUOPPN6579JF;5;Simplesmente perfeito, chegou intacto, com muita antecedência.;2
8595083274;R12CG9PRNH0E4U;5;Ótimo livro, recomendo.;0
8543107202;R8OOTPFJCE77;5;É difícil encontrar palavras.;3
8535909559;RIOMU2KXF4C4Y;5;Em algumas obras como esta ( e 1984 ) Owell deixa claro a importância da memória sobre a história do seu povo para que não seja enganado.;1
8547000240;RLHNGD3Y8XKJ7;3;O tema do livro é excelente.;0
6555871784;RPHJRGBNTNXNX;5;Livro muito fácil de ler ,história de amor sem ser piegas!;1
8595084742;RJ28H0LZDM6MD;5;É linda demais, as ilustrações são lindas, a capa é perfeita, o poster é perfeito!;1
8578601777;R1SJLPC8I52N0T;3;Contudo, trás  riquíssimos saberes.;1
8543107202;R265VQMKAYX4UO;5;Ótima leitura.;0
8543105692;RIOIBSRO2Y63T;5;O livro chegou antes do prazo e muito bem embalado.;2
8532530788;REQCR0DHJEF76;4;Harry é um garoto de 10 anos que vive com os tios após a morte dos pais em um acidente de carro.;1
8565765482;R3BTATM3JZTE0A;1;Tem um linguajar às vezes pesado (justificado pelos personagens) e palavrões, mas fiz meu filho de 13 anos ler e foi o primeiro livro que o deixou curioso até o final, a cada capítulo ele vinha conversar comigo e tirar algumas dúvidas.;1
6599039812;R1GGSHQBPO2RE3;3;Um livro ok.;0
8550802751;RZP1V8HBMNNVR;5;Que livro incrível  , uma grande lição de vida !;1
8543106591;R10ID8PNE0OMJL;5;E eu pessoalmente, mesmo já adulta, fiquei apaixonada :);1
8535909559;R2LXPLL8IHR7PV;5;Comprei esse livro é necessário para um leitor que quer enteder tudo sobre comunismo e socialismo político;1
6555111100;R1QTOBLPDAIKUZ;5;Você vive fazendo o jogo de surfar no momento dos investimentos que hoje estão em alta e fazer uma grana rápida ?;1
8550807567;R3QHWGFS76A6VY;2;Um livro com foco que devemos criar hábitos funcionais em nossa vida e para isso é necessário recompensar  e reforçar os bons hábitos.;1
8543107202;R13UOZY1DRXIJB;4;Ouvi falar muito bem dele, porém a entrega deixou a desejar.;2
8578601777;R1QKAME8YZ63I8;4;O LIVRO 1.;0
8594541473;R2VM834LG5ATQ4;1;Esse livro é uma decepção quem ama livros sobre crimes terá uma tremenda surpresa no mal sentido.;1
8501117846;R3TB5TS8BD7SER;5;Mais uma vez CoHo não decepciona, arrasou no seu primeiro triller!!;1
8501076252;RAMDE9E92DFI6;5;Lindo;3
6555871784;R1UYV12YDLWT7X;5;A escrita da autora te conquista logo nas primeiras linhas e você não consegue mais parar de lê-lo.;1
8584391509;RRDNINXPAIBK1;5;A forma que a autora escreve é indescritivelmente fluída e viciante!;1
8576849941;R1CZN6YJF99E0W;5;#;3
8573258926;R3DNGFZF1ODSJE;5;Vou deixar mais algumas frases utilizadas no livro, aproveitem!O amor não oferece resposta para tudo, mas cria um clima de segurança no qual podemos buscar soluções para as questões que nos aborrecem.;1
8538058975;R2XAAXCX796Z3I;5;História boa de se ler;0
8595083274;R1E29AUVTXOR5T;3;Em termos de conteúdo entendo que não haja um grande diferencial para outros livros que tratam do mesmo assunto.;1
8565765695;R2QDW24RJSODEH;5;Veio em ótimo estado, a única crítica que tenho é porque na hora de embalar com o papel amassa um pouco as bordas, mas isso não atrapalha na Leitura.;2
8584391509;R2SH3A7OEUTS67;5;Na página 20 eu já estava apaixonada por Evelyn.;1
8539004119;R1RTSVDMDR2KVN;5;Muito fácil a leitura e com um bom entendimento.;1
8576849941;R2266RIXPKPEBB;5;Tem o poder de melhorar a vida de quem o lê.;1
8501117846;R2XO9EBG40TANO;5;estejam prontos para embarcar em um suspense que vai mexer com a sua cabeça.assim que comecei não consegui largar, o tempo todo me senti presa na história assim como a própria personagem.acredito que o final poderia ter sido melhor, mas também fica o questionamento dos leitores, é verdade ou manipulação?outra coisa que gostaria de ressaltar;1
8543105293;R3Q2TGF5MA13V1;5;A paz de desacelerar é relembrada.;1
6580309318;R3E909Y2NDIYMX;5;Emocionante do primeiro parágrafo ao último.;0
8576849941;RBTQVCH82CL74;1;O material do livro é de baixa qualidade.;0
8532649963;R3PX6WIFSVQJQ8;5;Muito bom e, falando para um grupo em particular, ajuda a explicar os “supercrentes” e fenômeno dos pastores blogueiros e televisivos desse triste século XXI.;1
8547000240;R22SYA1FZ1DIS7;5;Livro de leitura boa e rápida  informações coesas, gostei;0
8595083274;R3VCPCFB8LKD86;5;Parabéns ao Nigro e muito obrigado pelos ensinamentos.;0
8573258926;R30RS70SX9CNGC;5;Esse livro é maravilhoso, ajuda muito a entender várias coisas que não dão certo nos relacionamentos.;1
8543105293;R1PSL0LHW452FZ;1;Aguardo informação;3
8543107202;R2EGDTAXUCE8FX;3;Sou um entusiasta dos estudos da Tanatologia e da história da morte.;1
8551002341;RCL38W7HE7CF9;3;Ou seja, esse livro devia ser perfeito para mim.;1
6555871784;R1NK5MI7CC69O7;5;!;3
8501112518;R3TU6G2PXBT645;5;se prepara pra sentir altas emoções e chorar bastante!!;1
8575422391;ROG1UTFQRIA2E;5;Se ela possui uma raiz negativa, como o medo, a raiva ou a necessidade de provar algo a si mesmo, o dinheiro nunca lhe trará felicidade.;1
8535933921;R3EZTXWPT4CMMC;4;Obra interessante.;0
8501304468;RJUJVFBWM772R;5;A escrita da Holly Black é deliciosa.;0
8594541473;R2CORD9E2YVGOS;5;indico;3
8576849941;R2HNDIVQCV1E1I;1;Não valeu a pena.;0
8542209826;R3JDXJZS96J0YQ;5;💓Poppy e Rune se conhecem desde a infância e se apaixonaram perdidamente, o qual ao longo dos anos esse amor foi fortalecendo a ponto de ja terem o futuro de ambos planejados e entrelaçados.;1
8584391401;R1FVOA0MW0KRBQ;4;Um livro bem interessante, com vários pontos para reflexão.;1
8535909559;RXIHA2W27HUUN;5;Se está estudando sobre isso, essa é a edição!;1
8565765482;R1HD1UMHMNXAPF;3;Sobre a história: Não se pode dizer que é clichê, mas o final é bem fácil de adivinhar.;1
8568014003;R1G7N70JOO1IAE;5;ESSE LIVRO DEVERIA SER;1
8595081530;R1PT7V3Y0ARWHQ;5;Excelente para iniciantes estão iniciando qualquer um desses trilhos.;1
8594541473;R1A5NH1AK7QKSF;5;Capa Dura e desenhos e escrita muito bonita.;0
8576849941;R3TK44KP8GRLRU;5;Dedicar tempo lendo o Milagre da Manhã é investir diretamente em ser melhor no segundo seguinte.;1
8576849941;R179CE2Z94ODEI;5;A Forma Direto do autor entregar o conteudo, simplisme te fax querer or em frente.;3
6580309318;R9HQQY59J6ISV;5;No decorrer da história, é narrado os detalhes sobre esse romance e os percalços na vida das dias.;1
8595081530;R2W2N9GS65QNKB;5;Ótimo!;3
8580411971;R2419F0MYA7RNT;5;Me diverti em diversos momentos, principalmente com as alfinetadas que Anthony e Kate trocavam.;1
8594541473;R3BSHOKNITHE72;5;Já vem com marcador de página!Para amantes de criminologia que querem conhecer um pouco sobre a mente dessas mulheres.;1
8501117684;R1LQM8DDYU3WCH;5;Comprei pelo hype e me apaixonei nesse casal.;1
8550807567;R6OVN4CPKZYVX;5;Bem escrito e pratico com informacoes pra quem quer mudar de vida.;1
8535909559;R16TV0K14PW7I5;5;Gostei muito do livro recomendo;0
8539004119;R2RKP9OGDI248D;5;Recomendo muito...;0
8508196555;R2WAP6DN1DJ27R;5;É só isso mesmo.;1
8535909559;RE3QJ9MBMDB3Q;5;O livro chegou em perfeito estado.;2
8555340896;R1LKZL0NC0ANE;5;Adorei a capa e todas as referências geeks contidas nela e no decorrer da história.;1
8501076252;RHULFVKTLVQN4;5;Escrita e enredo viciantes, nada monótonos.;1
8574068012;RRIW7HP5IYFX4;5;Pede para lermos toda hora!;1
8584391509;R1HJ404GGSCWQP;5;Passei por vários sentimentos ao longo desse livro, raiva e tristeza sendo os principais, principalmente em relação a como devido ao mundo que vivemos, acabamos tendo que sacrificar a nós mesmos para garantir certos direitos que, para outros, são concedidos naturalmente.;1
8565765695;R93CLN6K9CNJD;4;Ela virou a chavinha e virou líder do movimento.;1
6555871784;R37UYH1GPO501R;5;História linda e forte de uma autora brilhante.;0
8542209826;R350NDVJYJXBMW;5;Tillie;3
8568014003;R28G77XSGWQV4U;5;Agora só colocar em prática as palavras do escritor.;1
8532530788;R1H5CUS8LN4VJL;5;Super recomendo!!;0
6555871784;R2CVY29UW3K8CI;5;Que livro, minha gente.;0
8580412382;R1L0FRIKZPF56O;5;Nós vimos nos dois primeiros livros até apenas as damas (nesta série), criadas como verdadeiras princesas, então, esse terceiro para mim foi uma surpresa, foi exatamente a diferença que estava querendo ler.;1
8584391509;R29QIP5DGKN0V6;5;Obrigada por fazer isso sem ser rasa.;1
8550802751;R1R4YLVNG93ZU;5;Não há como definir esse livro, qualquer resenha se torna deveras simplista.;1
8532530788;R3B6GZEO2OI1YT;5;Depois de assistir todos os filmes mil vezes, resolvi ler e é como se estivesse dentro de Hogwarts acompanhando tudo.;1
8584440739;R10JIBT8MXYD7E;5;Ótimo livro;0
6555650001;R3BKCXK5LSACOT;5;Valem super a pena;0
8551006754;R2TW0ZI0PXNYT4;5;A empresa Loggi é a melhor transportadora que a amazon escolheu.;1
8578601777;RXVMFKTG1V6MG;5;Top, demais;3
8543104335;RDBTJ184LPR9U;4;Dei 04 estrelas porque não faz o meu perfil de leitura, embora eu tenha gostado da experiência de lê-lo.;1
8542209826;R1SF1QFXDW6T0Q;5;Chorei, me diverti e levei comigo cada lição que essa história linda tem a oferecer!;1
8575422391;R2YDQL822DCDU;4;85% autoajuda, 15% para orientação de investimentos.;1
8595083274;R2Q6FU0BJPEBUE;1;Infelizmente não gravei quando recebi.;2
8535909559;R1OZ2WR6YRLWX4;5;Excelente livro, super atual!;0
8595084742;R2LB8LVCNRY8LU;5;Um clássico, contudo o meu produto veio sem o pôster!;2
6555871784;R3RHULQ5FLQ5T7;5;O produto veio em perfeito estado;2
6555650001;RF2OKO54UVMFN;5;Na época em que conheci a história, não tive a oportunidade de ter os livros físicos, mas confesso que fiquei tentada, e não resisti, em comprar essa linda edição.;1
8575422391;R145P36J2J0PNF;5;Leio muitos livros sobre negócios e riqueza em Ingles e Português a anos;1
6555650001;R1O6TLEIYIDB4W;3;Mesmo com tudo isso, “O Duque e Eu” pode ser considerado uma leitura agradável.;1
8501105732;R3MTGJAP1QUOSU;5;Eu chorei!!!!!!!;0
8576082675;R29KJOWU1KM1A3;2;Uso o Kindle para Windows.;0
8595084742;R2ZR1I5LH878NP;5;LIVRO BONITO LIVRO GOSTOSO, LIVRO MARAVILHOSO.;1
6555650001;R69BUT4S1ITSU;5;É um romance de época, levemente sensual, que prende e flui desde o começo.;1
8584391509;R1RNQ5Z5UG3SW;5;O livro chegou em perfeito estado.;2
8535932879;R2LECBQH0VDXBN;5;Deveria ser lido por cada cidadão brasileiro.;1
8535932879;R3FZYYGCWQ89S;5;Amei;0
8568014003;R3NWJUKZI9OIUL;5;Não tem como terminar esse livro do mesmo jeito.;1
8546501459;RTVXXMRM47E9O;4;Alguns descontos devem ser dados, mas vale muito a leitura.;1
8501112518;R1GG34WT2FL6DO;5;O livro é simplesmente maravilhoso!;0
6555650842;R8E733GLDI2VY;5;Owwm eu amei os personagens, principalmente o Anthony ele é um fofo muito perigoso e galanteador...;1
8551006754;R3Q2P0MRXOLK81;5;Chegou em perfeito estado;2
8543107202;R3L50S5A9XJFWM;5;Nos mostra um novo olhar sobre a vida mesmo.;1
6556402583;R2UEJNTHTE0JHR;5;Gostei muito do livro e meu filho tmbm, porém algumas palavras ele ainda não entende, então ao contar a história eu uso sinônimos.;1
8576849941;R24ECG3IYC7KAN;5;Ancioso para os resultados.;3
6555871784;R4RXTGI84QBB5;5;amei;0
8539004119;R1UBJXPQ9OLWGQ;5;Gostei da forma que o assunto foi abordado, sem invenções milagrosas e apresentado como um estudo científico.;1
6555871784;R6ZXQ6IY5GWAH;5;Não vou contar nada.;3
8595084742;R2O8JE1XRSY6WK;5;Tanto o produto quanto a entrega superaram muito as minhas expectativas.;2
6555650842;R1JVSZPW719N65;4;Mas veio com um arranhão 🥲;3
6580309318;R2FHGGVDKVLVZG;5;Um grave acontecimento que as une de forma carnal e espiritual.;1
6555651059;R25I0OE9KY76QJ;5;Eu amo essa série e era meu sonho comprar o box.;1
8547000240;RIXX1WP8P5JVB;5;Gostei muito do site, facil navegação.;0
8580411971;R197E1CEQ8RP7H;5;Simplesmente maravilhosoooooooo amei demais , já tinha a versão normal , mais me apaixonei por isso , entrega exatamente igual na propaganda;2
8532530788;R1ZIYROP7R9ITE;5;, recomendo a todos os fãs de HP;1
8551006754;R1IOOQQS2PT77X;5;Desde Sandman eu me apaixonei de verdade por esse poder que ele tem de construir histórias, apesar de que, o estilo que o autora escreva, não é exatamente o meu tipo de gênero literário favorito e mesmo assim, eu me vejo encantada com tudo já li dele.;1
8575422391;R15W5UK8RF078C;5;Gostei dos Arquivos de Riqueza.;1
8532530788;R1JM618L82J06H;5;Perfeito!;0
8501112518;R22P20UTF0T96S;5;XD;3
8501117846;R2G43ZHV6VW7DX;5;Prende a atenção do começo ao fim.;1
8544106595;R1PNNG8B7EGX1J;5;Várias vezes eu precisei parar por um minuto antes de virar para a próxima página, porque o fim de um poema foi como levar um soco no estomago.;1
8542209826;R1YL2NCZUWKWFG;5;Esse livro é puro e doce como o amor de dois jovens, te encanta faz você sentir inúmeras emoções.;1
6555871784;RF5272FXYVC7Q;5;E que, sob a simbologia do rio que suja, contamina, traz turbulências, mas também proporciona a harmonia e a purificação.;1
8501112518;R3AECC0VNJCEZ1;5;Apaixonante.;0
8580411971;R2ZKK9H6K095UT;5;Que livro maravilhiso, fiquei encantada com a historia...;1
8547000240;R34KYD7FPKEB9Z;5;Ela descreve a diferença entre dois tipos de mentalidades que podem existir nas pessoas, de forma que uma é extremamente prejudicial nos mais diversos sentidos (midset fixo) e outra (mindset de crescimento) faz que a pessoa consiga enxergar a beleza em suas jornadas de busca de seus objetivos e buscá-los da maneira correta.;1
8595083274;R30SN33H12NW9V;5;Livro muito educativo e claro para quem deseja aprender sobre investimentos.;1
8539004119;RXAOP4MTL0KHW;5;Gostei bastante, leitura boa , com as técnicas e explicacoes de fato.;1
8595083274;R3D7246IEZUBL7;5;Livro muito bom e completo.;0
8501076252;RASNC2S78U12S;1;O que mais me incomoda no livro é a irresponsabilidade  do personagem com o que ele fez, como isso abalou a todos  e ele não foi capaz de assumir e pagar por isso.;1
8555340942;R2K6LN6FTHPGKJ;4;Antes de ler, achava que se tratava da fórmula de inimigos para amantes, mas o fato de o Alex ter um crush no Henry desde os primórdios da adolescência transformado em ressentimento quando foi mal recebido ao se conhecerem parece-me uma postura bastante compreensível.;1
6553623163;R2L305CZQS08QN;5;Ótimo produto.;0
8551002341;R243LEXOXSZLY6;5;Mas guardava um segredo - nunca falava a respeito do pai de Lina, até que antes de morrer a faz prometer que viveria com ele na Itália, porque a única pessoa que confia no mundo para continuar cuidando de Lina é ele.;1
8535932879;R2PFQCINLXPNMS;5;Djamila não apenas aborda a temática do racismo estrutural e da luta antirracista de forma acessível a diferentes públicos, com uma linguagem objetiva e de aproximação com o cotidiano, como nos oferece  ;1
8565765695;R2R3NSA2DIH9LJ;5;estou lendo e é maravilhoso;0
6555650001;RQ91Z2XAFEQAB;4;Embora a autora não tenha memorizado as cores de seus olhos, todos os oito têm estruturas ósseas semelhantes e os mesmos cabelos grossos e castanhos.;1
