book_id;review_id;review_rating;sentence;kmeans_label
8595084742;R2AA3BHS7YJYA0;3;e não havia necessidade dessa adaptação dos nomes já muito bem estabelecidos no imaginário nacional.;1
8574068012;R2QD8JQ1FD3D9I;5;Sugiro ler bocejando, quando os bichinhos estão muito cansados, e com os olhos bem arregalados, para sinalizar o animal que está acordado!;1
8501117684;R1LKR386LIZ12O;5;️;3
6558380544;R3QT8J5QBVX7Y3;5;Ela pode conseguir diminuir sua lista de arrependimentos e ter uma ideia do que seria sua vida.;1
8539004119;R2CH6N1UWYHUQG;5;Muito bom!;0
6599039812;R1VEHCFQMD9DEP;5;Melhorar mas os conhecimentos;3
8575422391;R3M42B4H8APP88;5;É sobre aprender um princípios e colocá-los em prática para alcançar o sucesso!;1
8543102146;R2RYWJZLEM2022;5;Magnífico;3
8584391401;R2OUK9CKAG6BCM;5;Vc vai lendo e fica imaginando eles dando entrevista e contando as histórias pelas quais a banda passou.;1
8535909559;R2H92LSUNE95M7;5;A ficção seria um devaneio da realidade, mais o autor foi profético.;1
8535909559;R19HO40BLUKCQZ;5;O livro em si é fantástico, Companhia das Letras sempre com ótimas edições.;1
8575422391;RJKOIMKSK9DNQ;5;Melhor livro da vida ...;0
8573020806;RQTSW5I714B9;5;Então, quando digo que o livro é um espécie de terapia, sim, ele é.;1
8595083274;R3HF28T2WVDJJV;5;Trata das mais variadas modalidades de investimentos, da renda fixa à variável e empreendedorismo.;1
8584391509;R3EIP0NPTXYI02;5;A história é envolvente e quanto mais Evelyn fala sobre sua vida e amores mais você quer saber sobre...;1
8595081530;R2TQ3D96DH6K15;5;recomendo;0
8543107202;R3EPL5C2VISBZQ;5;Livro muito útil, recomendo para todos os profissionais da saúde.;1
8576849941;R1NBO3L5HOHWMY;5;Muito bom!!;0
8595084742;R2WFA3XBELTRFC;5;A única coisa que tenho a reclamar é que na nova edição as falas são destacadas por aspas e não separadas por travessão como estamos acostumados mas nada que você se lembre depois de 1 capítulo.;1
8543105293;R34ZET6YL31TBX;5;Maravilhoso!;0
8595081530;R3CUHTKVUP3FEU;5;.;3
8568014003;R3TJUQJEJLY9E0;5;Vale a reflexão de cada página.;3
8532649963;RJXRMMIU59B6Q;5;Este excesso poderá nos levar a doloridos sintomas como depressão, ansiedade etc.;1
8595084742;R2NJ37OL8QKY9;5;Livro para todas as idades.;0
8568014003;R2KN3DYFUUVHAP;5;Além disso, a leitura bastante, uma vez que o autor expõe seus pontos em forma de entrevista.;1
8501112518;R2X4ZSVIHFBP0N;4;Fora isso, é um livro muito bem escrito e necessário.;1
8595084742;R1V29W5LNZ0AJN;4;Muitas características das outras histórias de fantasia foram inspiradas deste livro, mesmo quando o autor assume ter outra referência, esta ainda é provável de ter tirado algo em comum da aventura de Bilbo Bolseiro.;1
8550802751;R141S5SB94GUN1;5;Simplesmente sensacional!!!;0
6580309318;R3611TR8BI2OA3;5;Mto bom o serviço e o livro.;0
8501105732;R3VPO3ZSO9XXI8;5;O livro me prendeu bastante a história é linda.;0
8565765482;RLZSG30DYAYHA;2;O livro é ótimo, mas o produto veio com 6 folhas rasgadas e um pouco amassado!;2
8501105732;R1UWTVB1CB43SR;4;ja coloquei todos os livros da autora  na minha lista .;1
8542218752;R2GDJGKZVF96UI;5;Que livro meu povo.;0
6580309318;RUKTK74HQRF3Y;5;Pedem pra gente ler autores brasileiros mas salgao os preços dos livros.;1
8539004119;R1J3QA0JXF1CSU;5;Excelente livro!;0
8584391401;R1O3IE7E7J10UG;5;Incrível.;0
8535909559;R1LKNFWXTJ8FOF;4;Livro indispensável aos que se interessam por um entendimento não-monofásico das grandes ideologias e da pequena política.;1
8568014542;RT1XKWH899EWW;5;Estão de parabéns.;0
8532649963;R3A86KUABMVN1Q;5;Penso que todos deveriam lê-lo para compreender em que dinâmica de sociedade estamos e quanto nos custa viver desta forma.;1
8543106591;R2DCK94NPWWQR8;5;O livro é grande, explica muitas emoções, ótimo também para adultos.;0
8574069051;R1W4FYYRUW00IL;5;A história é bem divertida e os desenhos são lindos.;1
8568014003;R167UOS04TEOG;5;Livro muito bom.;0
8582892101;RD04NBD2RT7EM;4;livro chegou em perfeito estado;2
8501105732;R2P4QI6B36II98;5;Se tornou o meu livro favorito!!;0
8584391401;R2HCON0B0LWOQO;2;Acho que nem era amor pelo Billy, era o ego ferido!!;1
8584391509;R2Q9QK2BAYN1BR;5;Entrega muito rápida e em perfeito estado;2
8532530788;R2P5Y8OCB3OLDJ;5;Livro incrível;0
8532649963;RJHBNY5PLKPUD;5;O autor expoe de forma brilhante e contextualizada a radiografia exata do momento que vivemos.;1
8568014003;R3DFV2B9859T13;4;o produto parece bom, ainda nao li...;2
8568014003;R3A13O6UZNU03M;5;Realmente esse pode ser um gatilho para mudar como você vê as coisas ao seu redor.;1
8575422391;R1XFDI1Z7S7GJS;5;Lindo!;0
8575422391;R145P36J2J0PNF;5;muito pouco investimento para quem realmente quer enriquecer;1
8594541635;R1T4NQC3WG3O20;2;Não sabia que o livro é tão infantil (pelo menos, o filme não é).;1
8501076252;R1XXQR7Z5XITJK;5;E bem leve de ler !;0
6555871784;R175BQGEW2GNJM;5;Eu simplesmente devorei!Amei de muitas maneiras, achei um livro sensacional.;0
8543107202;R2EVM4MUZQQG08;4;A vida acontece todo dia, e poucas vezes as pessoas parecem se dar conta disso.;1
8578601777;R1B9RNRVKBN69D;5;E mesmo que traga justamente muitas respostas, ainda acrescenta muitas coisas para se pensar...;1
8535933921;R34R6YG0HYUAQQ;5;Ainda está lendo, mas o pouco que leu já curtiu.;1
8532606261;R3VQSUSXJTTOA1;5;São dois livros em um só, uma história de vida numa situação de grande dor e sofrimento… e reviravolta onde há a definição de um método para ajudar a humanidade;1
8573258926;R1Y4FZEUTOOBKX;5;Entrega extremamente rapida.;2
8501117684;R1JD2OSK3JVWIS;5;amei o livro , tem um grande e surpriendente  plot twist;1
6580309318;R2LXOFR4WR5139;5;Um grande livro, literatura de primeira linha, épico e envolvente.;1
8501112518;R2K85O4Y7SYO7R;5;Uma leitura que me fez sentir na pele a situação da violência doméstica e a dor de amar quem te faz muito mal, e nos mostra como é importante tomarmos as decisões certas, nos momentos certos, mesmo estando em situações bastante difíceis.;1
8595083274;R3DZS884GYO5PU;4;PS: eu não conheço o trabalho do Thiago no YouTube.;1
8551006754;R3KEGEC4HT1E6V;5;Que edição linda,cada detalhe lindo que não tenho palavras ara descrever.;1
6555650001;R1O6TLEIYIDB4W;3;As demais personagens, figurantes ou não, são igualmente interessantes, especialmente a misteriosa Lady Whistledown.;1
8594541473;RXXJ12FP74G7J;4;bom;3
8565765695;R30AJJ039W2EVG;5;Melhor história que já li até hj, cheia de reviravoltas, traições inesperadas leitura muito confortável.;1
8551006754;RGGZIAW6W2YHY;5;Presenteie minha sobrinha e ela adorou!;0
8535909559;R27UXD5PWL1242;5;O livro possui ótimos predicados : um grande autor  , uma grande história e de leitura fácil .;1
8595084742;RLROH2ADT9QMD;5;Esse livrinho é um dos mais bonitos dentre todos os que já adquiri.;1
8580412382;R3R0Y1Y92LJS7S;5;amei amei amei.;0
8535909559;R1U999A402A5A1;5;Apesar da idade, é atual.;0
8574069051;R1C61XT85JCETR;5;Meu filho amou!;0
8542218752;R3DYFQ25SQ700G;5;Um dos melhores livros do Tiago Brunet, Super recomendo essa leitura obrigatória para aqueles que desejam ter bons relacionamentos com as pessoas de qualquer situação;1
8576849941;R2ZUCFLA5UBFTD;4;Livro bom, bastante funcional, poderia reduzir a quantidade de páginas.;1
8539004119;RBRUEZ4P7E1X0;5;Livro popular que ao ler você entende o motivo, abriu minha mente para detalhes sobre o funcionamento dos hábitos e de sua importância no dia a dia, pude identificar como alguns hábitos negativos em mim e quais são seus gatilhos.;1
8595084742;R2Z49AU1BPBMLL;5;Depois de 20 anos que li ele pela primeira vez, o livro continua excelente.;1
8543102146;R1XUYOOLLXZKB3;5;Excelente livro.;0
8595081530;R17E1E7TALNLBD;5;A riqueza que promove gozo e satisfação para seu proprietário constrói-se gradualmente, porque é uma criança nascida do conhecimento e persistência.;1
8546501459;R3DWS3Q062ST6S;1;Um livro cheio de exemplos ridiculamente ruim sem nenhum nexo.;1
8544106595;R23LWDS5ZCSVIP;1; ;3
8595081514;RKAGCTPIQVHK5;4;Excelente presente para quem você ama, mais ainda pra quem ama livros para colorir também, pra fechar com chave de ouro se ela gostar da história do pequeno príncipe como o meu amor gosta!!!;1
8539004119;RX3UYKS3F2P1I;4;Leitura fácil, com referências cientificas.;1
8535909559;R1SUF4UXZPK1U6;5;Apesar do subtítulo no site dizendo Um conto de fadas, é mais apropriado dizer que é uma fábula, e como toda fábula (pois os animais ganham consciência e capacidades humanas), traz uma mensagem poderosa com ela.;1
8595081530;R21APN6XVP5JVL;5;Excelente livro de educação financeira.;0
8594541473;R793486RGSG6I;5;A linguagem, na medida do possível, é leve apesar dos horrores que conta.;1
8539004119;R2OMNOQHQEK7EC;5;Produto chegou muito rápido e bem embalado.;2
8544106595;R26TQ0SJD6O1CI;5;Muito bom eu amei;0
8575422391;R2VAOXA2ZUS86C;5;ótimo livro, ótima leitura;0
8565765695;R3TPFN1SM5T889;4;🖤;3
8543102146;R26JQMWCGF7OXZ;5;Um livro essencial!;0
8538058975;R37X7E7P7PWASH;5;Meu sobrinho gostou do livro e também ficou surpreso com a quantidade de palavras que ele conheceu através da leitura desse livro.;1
6555650842;R3FB5M4E7PM9SW;5;Livro chegou em perfeito estado.é;2
8555340896;R1KZ73J0LZWMVL;5;Queria ter tido essa representatividade na adolescência.;1
8538058975;RDPF6M4S64E2E;5;Embora seja de capa mole, é um livro resistente.;1
6555650001;R2IZI423IG3Q1G;5;Nada a reclamar.;3
8555340896;R11HWRPV82L0KJ;4;A escrita da Clara é muuuuito bonita e o livro é daqueles que você pega e não quer largar.;1
8555341612;R35R0AQIAZ3F97;5;Foi presente para uma amiga 🎁;3
8584391509;R1EZAWQ0SW97WX;5;Com certeza Evelyn Hugo merece ganhar ainda mais vida do que já ganhou pelas mãos da Taylor Jenkins Reid!;1
8535909559;R39Q723JJ16VI4;5;Assim como 1984, este livro traz à tona aspectos políticos nunca contados em livros tradicionais de história.;1
8501117846;R1K30XUPJJ0SIT;4;Suspense na medida certa, mesmo que você imagine a problemática rapidamente, existem diversos questionamentos que fazem você duvidar se está certo ou não.;1
8550807567;R214GBPCBNMIWE;5;Livro maravilhoso!;0
8532530788;RHZOT2DXO0XL6;5;Perfeito, nenhum defeito!;0
8576849941;R1EIM8XKXB936M;5;Para quem quer mudar de vida e deixar de procrastinar, esse livro é um bom impulsionador.;1
8584391509;R1J5W894V9V1QV;5;eu ja havia lido Daisy Jones &amp, The Six da mesma autora, ja havia me apaixonado pela escrita e desenvolvimento dos personagens,;1
8568014003;RZEWPRVW05A20;3;Achei o livro com o início e meio interessante e ponto.;0
8542209826;R2RYEV803S7JTA;5;Um Romance super fofo, cativante e leve, deixa o coração quentinho, desperta na gente uma emoção gigantesca, chorei horrores, mas fiquei muito contente com a história em si, do começo ao fim.;1
8532530788;R2467XUSJ73SAC;2;Não importa o tamanho da letra, a separação das letras no final das linhas fica completamente errada, tipo indepe-ndente.;1
8565765695;R1T3VD17WOP7D0;5;️;3
8580412382;R10V56DI427FU4;5;Romance de época, muito bem escrito.;1
8576849941;R2MLIE9FSUK5YO;1;O livro poderia ser reduzido consideravelmente.;1
8565765695;R3N7JW6WQ45NL5;5;Todos estão apenas vivendo, como na vida real.;1
8573258926;R18DA5B5FKATWM;5;Eu simplesmente amei.;0
8575422391;RHHY0HQKFWBVH;3;É basicamente um livro com toque de auto-ajuda.;1
8595083274;R2BA3AYVMZB2OO;5;Muito bom o livro, super recomendo!;0
6555871784;R3U2HPL7O5VRKE;5;Fui cativada pelo enredo e me envolvi na história das personagens.;1
6555871784;R1O41GZLF69Q9G;5;Quem vê de fora fazarranjos melhores, mas édentro, bem no lugar que agente não vê, que o não darconta ocupa tudo.;1
8547000240;R333ZCMUIMW6T4;5;O livro é bom, a mensagem é poderosa, são citados os estudos e os resultados que corroboram a tese.;1
8568014542;R2DMZCBEOJJ7WO;5;O livro físico ainda não li.;0
8565765482;R3KQJHKMNJ3EXL;4;❤;3
8535909559;RW49ZU3QPO5E2;5;Livro que todo mundo deveria ler;1
8532530788;R11X7H5DOK49YR;5;Recomendo ler o livro e depois assistir ao filme;1
8501105732;RVOUVK9QTQEM2;5;ele se entregou a dor, mas superou.;1
8535932879;RXH3AYOWS5OI5;5;Muito bom!;0
8568014003;R1W6L9OZ6PZYOL;5;Abre nossos olhos.;3
8550807567;R27U8TSRPUX9GG;5;Impressionante como criar uma identidade flexível mudou minha vida;1
6580309318;R3QTO3P06O4WDA;5;Entrega ocorreu sem problemas e de forma tranquila, livro chegou sem avarias e bem embalado, se quiserem saber sobre o livro, leiam a sinopse.;2
8573258926;R1A70R0RC75O27;5;Adorei.;0
8595081514;R1KJBMM2X29TNX;5;AMEI, vale a pena é profundo e fofo tirei varias reflexões boas;1
8584440739;R2IT6DDNGM8BQJ;5;Livro foi pra presente.;3
8584391509;R1L4UXVI46P3M8;5;Um livro que prende o leitor logo no início, com uma história envolvente e cheia de emoções onde podemos sentir o que passou a protagonista ao fazer alguma decisão e compreender a mesma.;1
8501117846;R3Q8NUNSJLBLEL;5;O que a mente humana é capaz de fazer!;1
8578601777;R2W14O045JOFSV;5;Além disso, a edição é bem bonita, possui relevo na capa e uma ótima gramatura.;1
8575422391;RG36KA8I0O30H;5;Passa conceitos básicos de riqueza e mostra os pensamentos pobres que você não deve ter , se quiser ser rico!;1
8546501459;R3LPMV9GB3Y1UP;5;Pra quem gosta de lei da atração e essas coisas;1
8575422391;R3O81WX3N5JWT7;5;T Harv Eker nos mostra de maneira fascinante  acerca das diferenças entre uma pessoa rica e uma pessoa pobre sendo que a maior diferença entre elas é o que o autor chama de modelo de dinheiro que um individuo recebe desde a infância.;1
6580309318;R46EBTRFSKIZF;1;Aliás, até falta página.;3
8542209826;R3BS6X5YUYHGQ8;5;É esse.;3
6555871784;RRZTY0Z3EALON;4;Teve um plot twist inimaginável.;1
8543107202;R3B9DS5IB32N2W;5;É um livro que fala mais sobre a vida do que sobre a morte, uma vez que ao falar sobre a finitude a autora diserta sobre diversos aspectos da vida como medos, rotina, família e espiritualidade.;1
8568014003;R1HM0IOGS87XGU;5;O livro abre sua mente para a forma de pensar e agir.;1
8555340896;R302XIQBPA4DFP;5;É aquele clichê romantico vom final feliz que a gente precisa no dia a dia.;1
8538058975;RO583JDSJZFLO;5;Muito bom.;0
6558380544;R3313KQR0PUMMN;5;É um livro que me tocou bastante por ser algo que eu já passei e muitas vezes passo, o pensamento que te consome por dentro de que se vc tivesse feito algo diferente talvez vc fosse mais feliz ou fosse quem vc realmente queria ser, mas sem ao certo saber quem é nesse momento.;1
8595083274;R353F2XK8WXWG4;5;Livro muito bom, um grande aprendizado para quem está começando a vida financeira e busca conhecimentos !!;1
8580411971;R2FZMV123SD7JD;5;Incrível, mais perfeito impossível, chegou no prazo e veio em perfeito estado 😻😻😻;2
8535909559;RVMB35K6U5B0E;5;Um livro incrível!Um clássico da literatura mundial, altamente recomendado.;0
8595083274;R6ETGIGP2FO36;5;Já acompanho o Thiago Nigro no Youtube e estava ansiosa por essa leitura.;1
8595081530;R2MO4V9SXUFLUS;5;Muito bom livroMuitas dicas simples que trazem resultados para a os.que;1
8575422391;R37CRP2I47WWKI;5;é isto pessoal;3
8594541473;R111ZMU0PGZUA4;5;chegou super rapido !;2
8568014003;R2OLQ1JJ0M7G0P;5;O livro é fantástico e revelador.;0
8535933395;R2VZ8HGTELG1GW;5;Perfeitooooooooooooooooooo;1
8574069051;R28TUNU8XXGT1B;5;Perfeito,  como todos dessa autora.;0
8595083274;R6YJQRFJD8OUJ;4;Recomendado a todos que querem aprender um pouco mais sobre finanças.;1
8578601777;R2MAXXHAMFX4XK;5;Ótima qualidade do livro.;0
8578601777;RHQD2AL1KYAOC;5;Creio que por se tratarem de discursos transformados em texto, a compreensão é boa e trata de temas sempre atuais.;1
8551006754;R1UD6EW7MQWS0L;5;A edição com as ilustrações faz você imergir ainda mais na história.;1
8584391509;RFM5CPEL81PFM;5;Uma enxurrada de sensibilidade e emoção e sentimentos que podemos usufruir com a leitura desse livro.;1
8539004119;R3FW9LM2FV76ZR;4;Através das histórias citadas é detectado um padrão que causa um ciclo.;1
8584391509;RCR7CE0GU86LQ;5;Esse livro me ensinou muito a olhar para a vida com carinho e proatividade.;1
6580309318;RJ9KYGXN0Y3U8;5;Arou meu peito!;3
8542209826;RWFJNWKMZWFNK;5;o livro chegou antes do prazo e veio em perfeito estado;2
6555942479;R2OR8UAYKZO5AN;5;Por ser meu mangá preferido, decidi colecionar, e não me arrependo!;1
6555871784;R28BQVPV9TYH6P;5;Difícil largar, mas muito duro para ler sem uma pausa para enxugar as lágrimas e respirar.;1
8543102146;R2VCEK0B4DOCCS;5;Creio que sempre devemos nos reavaliar enquanto pessoa em todas as esferas de nossa vida.;1
8501105732;R29FG967ESVKKO;5;como sempre a Collen n decepciona;0
8508196555;R2D0EEM8N226IL;5;Retrato de uma São Paulo não tão antiga assim.;1
8568014003;R3KOK4LIFQAI6;5;Esta literatura é para as pessoas de mente aberta que buscam conhecimento e tentam evoluir com a informação que cada um absorve a sua própria maneira.;1
8508196555;R2KIRJO9B7QJVK;5;recomendo;0
8573258926;RT1PLC2GTDY1V;5;AA.;3
8594541473;R3PAG39CYZ6WHM;5;É o livro mais lindo que tenho.;1
8575422391;R1PB7F77PLU724;1;Não gostei.;0
8551006754;R1M8XI041AK85V;4;O livro em si é muito bom, tem uma ótima escrita e desenvolvimento, porém acho que alguns detalhes presentes no filme, por ser mais popular que o livro, fizeram falta.;1
6555871784;R3604P3F58C36V;5;Incrível que esse seja o primeiro livro da Carla Madeira.;1
8584440739;RK2369CMZQ34P;5;Recomendo!;0
8546501459;RMF31ZES1V3PR;5;Adorei o livro !!;0
6555650001;R1O6TLEIYIDB4W;3;Mas, no geral, a narrativa  perde o foco frequentemente e fica tudo muito infantil, caricato, muito pastelão para o meu gosto.;1
8595083274;R1KAY5K6OROY77;5;muito bom, abre a mente para a sua gestão financeira.;1
8580412382;R34VWYYFKMBMAW;5;Ele a girou em círculos e espirais pelo terraço, primeiro devagar, depois mais rápido, até que ela ficou zonza e sem fôlego.;1
8582892101;R2MHSAV1UAKPCI;5;Excelente guia.;0
8576849941;R2YK7AV4LC7P7;5;A FAZER ALGUMAS MUDANÇAS EM NOSSAS VIDAS PARA QUE POSSAMOS VIVER COM MAIS INTENSIDADE, SER MAIS POSITIVO E LEVAR;1
6555650001;R328PHSY6DDGE3;4;Não foi nada disso.;3
8542209826;R1S9M1J2G7INDX;5;Não estava preparada para tanto sentimento e emoção que foi entregue.;1
8508196555;ROL39B6YPNG0T;5;A violência e a degradação moral imperam em sua favela.;1
8555340942;R1OU3I3U8JP8WW;5;No decorrer da trama vamos descobrindo que ele é obcecado pelo príncipe desde que se conheceram, ainda crianças e ele simplesmente o tratou como um ninguém.;1
8595084742;R3SOM3VO2P48G6;5;Produto entregue dentro do prazo e em perfeitas condições recomendo;2
8501112518;R2MQTSZ0L2SZW9;5;Muito envolvente e emocionante.;0
8501117846;R2AOE2801WA7WV;4;Foi exatamente a impressão que tive ao finalizar Verity.;1
8576082675;R2TVIG15VIYWFL;5;Sobre o produto, realmente é muito bom como todos falam.;2
8535909559;R28ERBPBMCE9BB;5;Li o livro num fôlego só.;1
6599039812;R1P1R1VTTKWYN8;5;Porém o meu livro chegou em perfeito estado.;2
8543105293;R3FPKID5AQE02L;5;Recomendo!;0
8576849941;R3F83FZAH3I80;5;Muito bom.;0
8501117684;R3NF2K6KATDS1Q;5;Com certeza indico;0
8595081530;R31HU20BOCU9I2;5;Sobre o livro, é ótimo!;0
8595083274;RQU17ZGQFEGH1;5;A segunda parte, que dá uma visãogeral básica sobre investimentos, e a terceira parte, focada no comportamento são as mais interessantes.;1
6580309318;R24MSCB7594L3C;5;O autor tem esçrita ágil, fluida e pulsante.;1
8595083274;R3DSASB0LQVF5D;5;Livro muito bom;0
8595084742;R1WUUH09OJEE9H;5;Edição absurdamente linda!;0
8501117684;RL1B4HDVYAFED;5;Uma história de amor linda, com grandes reviravoltas.;1
8535909559;RTG8V8ENBMXS7;5;Vale para todas as idades.;0
8575422391;R1G2CEK0S7QTYU;5;Ótimo produto, tudo bem embalado e chegou em 6 dias &lt,3;2
8535909559;RE5PBEAHQ0EY;5;Muito bom o livro;0
6555871784;R10IZ4POATXYFI;4;Escrita maravilhosa.;0
8542209826;R1ES1AYH70QZTO;5;Poppy e Rune tem a estória mais linda e o amor mais puro e verdadeiro…;1
6555650001;R31YUVR5D64B3G;5;Há o que falar desse livro, minha paixao pela autora, começou por esse livro, amei, tudo nele, os mocinhos, os arranjos, os planos para a mocinha se casar e ele ficar livre das jovens e mães delas, muito legal, muito amorzinho, com um toque de drama e diversão, assim q deveria ser, todos os romances de época.;1
6555320516;RZ4G4H6S4VHAS;5;Perfeito.;3
6555651059;R3D4Z3RQ1ETIUG;5;RECOMENDO.;0
8501105732;R1OQ48APA5MY5Y;1;Fiquei decepcionada com a edição de folhas brancas que veio.;1
8576849941;R16SGHOYRLGYG6;3;Não se extrai muita coisa boa, infelizmente.;1
6556402583;R2D7Z7DW9MWN4A;5;Comprei dois, um pra mim e o outro pra presente.;1
8573258926;R9GQCDT4PQ3K1;5;Realmente um best seller.;0
8501112518;R1VDCJ6ELZD75C;5;Muita sensibilidade, escrita impecável, edição gostosa de ler.;1
8565765482;RYKR9VHU7ZOTX;5;Super indico.;0
8584391673;R1WXCVV6N0XR78;5;Sofrendo sim.;3
6555127279;R2GRU8X2UH5B7F;5;Em perfeito estado e muito bem embalado.;2
8568014003;RVF3I6OEF1XV6;5;Cheguei até este livro por recomendação de amigos.;1
8595081530;R389USHOLQ7Y7B;5;Muitos ensinamentos ótimos para quem está iniciando.;1
8543105293;R1Z8055WHSWFZC;5;Um livro que te faz refletir sobre cada parte da sua vida e como  está lidando com ela.;1
8574068012;R2KK20LIC34897;5;Amamos o livro por aqui,muito lindinho e divertido;1
8547000240;R3O53ETFBUQYSX;5;aprendi muito com essa leitura e estou empolgada para continuar aprendendo...;1
6580309318;R34JSGX31JA035;5;Torto Arado é um livro de uma beleza e de uma sensibilidade que raramente tenho o prazer de ler.;1
8501076252;ROWWK7AJFX2KD;5; ;3
8595084742;R1XCXY8KV6MQQW;5;Veio com um pôster lindo.;2
6555650001;R2DKWS2JEN7D4T;5;Ameiii, veio muito bem embalado e cheirinho bom kkkk;2
8584391509;R1UY2T89LF7H49;5;livro leve na medida mais bem real, mostrando a que ponto o ser humano pode ir para conseguir o que quer, passando por cima de qualquer ideal.;1
8547000240;R1HARCWUHZYIPG;5;Este sucesso não prevem só de dinheiro, mas com filhos, business, etc.;1
8543107202;R1HOKGU5T4H8QC;5;Uma visão realista e simples do fim da vida...;1
8595081530;R11FGJKM98QZLA;5;Chegou em 2 dias, sem nenhum defeito;2
8584391401;R3H5SCTXDIOCE3;5;Perfeito estado!;0
8535909559;RPER4P4EH91R4;5;Nos leva a pensar como uma mentira pode se tornar uma verdade.;1
8595084742;RDV6ZRU48A4VT;5;Coisa de colecionador !;0
8535909559;RU4MZWJ72917K;5;Vale a pena.;0
8535909559;R1PNXFZP446ZZ7;4;Excelente livro.;0
8501076252;R2E6G33ZUFRK8T;5;Em outra mesa, Ben, um futuro escritor, escuta toda a conversa entre pai e filha e, inconformado com a atitude dele, resolve interferir.;1
6599039812;R111CEB1BSTEEQ;5;A gente termina o livro querendo um spin off das personagens e uma continuação da principal!;1
8576849941;R3DY636TF3DQNQ;5;Ainda não terminei de ler, mas estou gostando bastante, de cara ele já promete muito, e é uma grande responsabilidade, mas está cumprindo, está atendendo minhas espectativas.;1
8595084742;R2SMWTBBOD6TKI;5;Obra maravilhosa e textos bem diagramado.;0
8501076252;RZ7RTEHXHMES3;3;Querendo ou não, quando lemos os livros da Hoover, já sabemos que em algum momento a história vai ter uma reviravolta.;1
8575422391;R34CBIIZ1RPMCP;5;Não li ainda, mas pelo visto será um diferencial na minha mudança de concepção sobre o dinheiro.;1
8584391509;R15LWCF4NUGM43;5;Livro excelente!;0
8584391509;R3BY3J62Q8PX9P;5;Simplesmente incrível.;0
8542209826;R11NDL5R9PDHI1;5;Simplesmente apaixonada e chorando horrores com esse fim 🥺🥺;1
8542209826;R3DI1WWFEATW6K;5;Uma história apaixonante, triste mas linda que te prende do inicio ao fim.;1
8594541473;RSFK062K58GTL;5;O produto chegou quatro dias antes do prazo final, perfeitamente embalado.;2
8501304468;R14W0UDNI6MJ46;5;Veio em perfeito estado,bem resistente,com correção nas falhas eu ameiii❤;2
8550802751;R1U4TO8EIY4S9O;4;O título do livro é bem chamativo, se você passar em uma livraria, você pode facilmente confundir com um livro lotado de clichês motivacionais.;1
8594541473;R1A5NH1AK7QKSF;5;Realmente vale a pena!;0
8565765482;R31LVI3LHK5SPG;4;O plot talvez você consiga descobrir antes, ou ter a sensação de que possa ter acontecido aquilo.;1
6555871784;R1NBUM6I484XDZ;5;Que livro lindo!;0
8501076252;R2VZK8WVJ8UJGV;5;Os personagens são envolventes, não há como não ficar curioso para entender o que vem por aí.;1
8551002341;RASD0N7S4YGRL;5;Um dos meus livros favoritos!!!Perfeito, história cativante, você não consegue parar de ler de tão boa!Amei muito!;1
6580309318;R1RYP81FAQV9V4;5;Ainda estou lendo.;0
8584391401;R1Z5948RD0QOSY;5;eu li que nem vi o tempo passar e foi tudo na minha carreira, bejão;1
8535909559;R3DYCK3ZI5OGW7;5;Muito bom;0
8595083274;R23RHH79VEK5EQ;5;● DICA;3
8551002341;RDIYEUJKAAW8G;4;A forma como a história cativa é impressionante, mas queria um pouco mais do casal;1
8565765482;R3MA74RRGADXJU;5;Bom;3
8575422391;R1J8HRIBYIAF1G;5;Excelente livro.;0
8543102146;R3UWQ1GXOPDF8U;5;Você aprende a olhar pra essa rotina louca e perceber que é possível escolhas melhores para caminhar em direção ao seu objetivo de vida.;1
8595084742;R3MQ9Q951Q014Q;5;Chegou rápido e em perfeito estado.;2
8532649963;R1NH9VIHP6NIUX;5;Por outro lado, ter um tempo todo meu é lutar contra a toxicidade do próprio tempo e encarar todos os dias a mesma dúvida: estou sendo útil de alguma forma?;1
8550802751;R384YHXUM7XCTU;2;Fico espantado pelo o numero de exemplares que este livro alcançou, pois já li livros excessivamente melhores, mas com muito menos sucesso do que este.;1
6580309318;RE6H5ZWV67WWE;5;O livro é maravilhoso!;0
8551002341;R144Z6BV6UIHCV;5;As histórias que ela conhece sobre eles juntos era pensando que eles fossem amigos.;1
8595081530;R2OJCI6F9BAXBT;5;Um livro simples e com conhecimentos aplicáveis, mesmo em tempos modernos.;1
8576849941;R1KH6QAYC9NL33;5;A vontade de ler e ler é avassaladora...;1
8568014003;R1C10QUJDF0NPU;5;Um impacto positivo e enriquecedor, que nos faz avaliar muitos pontos da nossa vida, senão toda ela.;1
