book_id;review_id;review_rating;sentence;kmeans_label
6555871784;RJQ5HT89M5AWU;5;Vale até lembrar “Querelas do Brasil”, a música de Aldir Blanc e Maurício Tapajós que Elis consagrou:;1
6555650842;R3W5C0VYETGH4G;5;As cenas em que sua mãe o obriga a valsar com as donzelas nos bailes são as mais divertidas de toda a coleção, pois ela não faz isso apenas com Anthony, mas com todos os filhos.;1
8539004119;R114GLQB8AJDPF;5;Transformador;3
8595083274;R961FEGTD0REM;5;👍👍👍👍;3
6555871784;R308MY9NJVVZTV;5;Daqueles que sentimos falta quando acaba.;1
8575422391;R2ET1Y60TBGSJK;5;Ótimo livro para quem procura entender o comportamento, pensamentos e atitudes das pessoas bem sucedidas financeiramente.;1
8535909559;RE6MM7NT91UNS;5;Mais do que uma sátira sobre o stalinismo, ela vai além e retrata um mal real: o espírito corruptível do ser humano.;1
8568014003;R2JWPU0JG7HDJF;5;Li e pretendo lê de novo, na verdade sempre estou lendo algumas partes, para relembrar.;1
8544106595;R30R6VG6XLMSPR;5;📖Amanda Lovelace encara a solidão, morte, devaneios, inseguranças, incertezas e também o medo de forma;1
8551006754;R19MUYQEOHU5C8;5;Minha sobrinha amou o presente;0
8565765695;R1796N0R3AVHXV;4;Também gostei bastante dos cenários, da sucessão de ocorridos a qual dão ritmo ao enredo (e que ritmo), tudo se passa tão rápido que não dá para respirar e nem torcer muito por ninguém e a cola para tudo isso são as intrigadas e descobertas que nem somente os prateados têm os genes para os super poderes, mas não se preocupe tem o romance existe, mas não é o ponto principal do livro.;1
8568014542;RVP6YO7761JC9;5;livro maravilhoso extremamente elucidativo.recomendo á todos que já estão acima da média.;1
8584391509;R2FWZ9ZAEPYNIN;4;Um livro que nos faz perceber o quanto o preconceito pode ser arruinar o amo;1
8595081530;R1VIO56WGAPR6Q;1;RACISTA;3
8542209826;R4HBJ2S3DEVZW;1;Os dois são chatos na verdade, e extremamente pegajosos.;1
8565765695;R1YK0R9SMPBWSN;5;Eu ameii , a capa é linda , ele é maior do que eu pensava mas ameii e ainda vem com marca página;1
8538058975;RPTC7STZQSIHH;5;Chegou no prazo e muito bem embalado.;2
8501076252;R1V1EL6P8C84RH;5;Um livro cheio de emoção, descobertas, motivação, dor, pedras no caminho e muito muito amor...;1
8594541473;R1B2HE9A766B89;5;Os livros possuem uma edição luxuosa e com riquíssimos detalhes.;1
6555871784;RAKP30Y547MN;5; ;3
8543105293;R2QK7FMC7S6MX9;5;Precisa ser visto com calma e paz, para refletir nas palavras que o monge deseja transmitir.;1
6555871784;RRZTY0Z3EALON;4;Eu estava super ansioso pra saber como lucy iria seduzir o Venâncio, mas a autora interrompeu essa trama e deu outro rumo a narrativa.;1
8539004119;RO6ZO1R8CWXAD;5;Otimo investimento.;0
8580412382;R3SQPXJIPHI4SV;5;Sinceramente não se tornou o 1º lugar no meu coração do livros Bridgertons pq O Duque e eu tem um lugar  especial que ninguém tira haha.;1
6555320516;R1XKAGNTI8WWBO;5;Excelente produto chegou conforme combinado .;2
8501076252;R2J6MOIFB6PQ6O;4;️;3
8501076252;R1PSTLR2OHI87Q;5;Amei o livro e o plow meu Deus, fiquei em choque e tive que fechar o livro e ficar meia hora processando oque eu li.;1
8595083274;R32IEA1CYMIPJF;5;OBS: Eu era leiga no assunto e com esse livro e assistindo os vídeos do canal percebi que todos podem investir, só basta seguir o caminho certo e lendo esse livro pode ser o caminho para abrir sua mente.;1
8547000240;R2Y42YEGBRQGQN;4;A parte mais importante, que seria como mudar/gerenciar os mindsets, a autora dedica poucas páginas, deixando a coisa toda um po o vaga.;1
8501105732;RPZBVISURATHP;5;Estava querendo a muito tempo esse livro eu goste muito;1
8532530788;RKGZH8Q5N0L0J;5;Perfeito!;0
8584391509;R239EFX4OPCLCT;5;Indico muito esse livro;0
8532530788;RQ1NHAC8LA2YX;5;A previsão era pra dia 24 e todos os livros chegaram dia 15...;2
8501076252;R1HBJVB00FHWBI;5;Chorei bastante, plots maravilhosos, o Ben muito maravilhoso (quero pra mim porém depende kkkkk).;1
8535932879;R2XR8MZ0CFKE0I;5;Recomendo a leitura.;0
6580309318;R1NFG2LTPMEVOU;5;O tipo de livro que você começa a ler e não para por nada.;1
6555871784;R4KS50O80WKDB;5;Livro maravilhoso.;0
8595081530;R2ZJE1JLQA3P6;2;Invista o dinheiro que você ganha de maneira inteligenteOs contos são legais mas são extremamente simplistas e sempre querendo mostrar as 3 premissas.;1
8595083274;RW1EW7LAS90PF;5;Entrega rápida e produto excelente.;2
8595081530;R3J8DDRJYQRN7I;5;um ótimo e simples livro para uma maior noção e cuidado com a vida financeira, custo-benefício excelente, qualidade correspondente ao esperado.;1
8551002341;R2MGM3WK8IR4CV;5;Eu não tinha percebido como a capa é linda, e o cheirinho perfeito dos livros é de encantar, a capa é muuuito mais linda pessoalmente;1
8535933921;R2FDASL9ZY29U5;5;Linguagem e narrativa nota dez.;0
8501112518;R2J1VNLFS0WGK5;5;só leiam e se entreguem a leitura.;1
8555340942;R1G032N62KQRDC;5;kkkkkkkk.;1
8575422391;RLDA8YPDEV4OC;5;Recomendo a todos.;0
8551006754;RNHELFAQ7HPGV;5;O livro é costurado, tem um papel de gramatura padrão, e a impressão tem uma excelente qualidade.;2
8568014542;R2EV333UZCCXIR;5;recomendo;0
8551002341;R15HPY2DQGBU1;5;Leve e gostoso de ler!;0
8535909559;R5FBLX84IMFTD;5;Impecável!;3
8535909559;R2DAJWG6C4AZI;5;Extremamente necessário!;0
8584391401;RC62IFH7BMTYN;5;Gostaria muito de ver esse livro adaptado.;0
8594541473;R21EZ0MIT5IEJU;5;Livro desmistifica sobre o fato de não existirem mulheres assassinas em série e mostra que existem esses perfis antes mesmo de aparecerem nas notícias.;1
8595081530;R3MEZLZE54PHAW;5;Excelente livro.;0
8501105732;R34R8V67SS4MZQ;3;Até 80% do livro eu estava lendo só para saber realmente o que aconteceu no passado do Miles.;1
8595081530;R2PR1PX2QMGNK;5;Os ensinamentos, ou seja, o racional nele aplicado são muito atuais.;1
8508196555;R15S49YH530AFE;5;Edição digna ao marcante livro de Carolina Maria de Jesus, escritora, negra e  dignamente celebrada hoje em dia.;1
8532649963;R1KY1QIP3593TZ;2;Dá desânimo de ler.;1
8575422391;R1LG86OJ93M0RL;4;O livro e mais mindset, mas no geral e bom.;1
8535909559;R39VW3KUFASWS1;5;O livro chegou rápido.;0
8575422391;ROG1UTFQRIA2E;5;rendimento, poupança, investimento, simplificação.14.;3
8542209826;R2TBFW4N6VJLQZ;5;Mas não... É um infanto juvenil que nos ensina sobre amar.;1
8547000240;R1MF4ZGYCMG897;5;A autora reforça este ponto desta forma:;1
8576849941;R274TS4N1PZVOK;5;Consegui fazer algumas atividades;3
8584440739;R3EHFXMB4KXX2W;5;Fantástico.;0
8542209826;R1BB5XSCSRVNU3;5;muito a pena com certeza.;0
8551006754;R1QD7CWS7YET1C;5;Lindo!;0
8535909559;R3OB5JLHTJB9F9;5;Não é atoa que todos recomendam essa obra.;1
8538058975;R1PQGI2A6AFFR4;5;Ótima história!;0
8551006754;R1F4RXQ7UEB2TC;5;Muito lindo, as ilustrações são perfeitas.;0
6555871784;R22R2YXBTM17P2;5;Livro maravilhoso!;0
8539004119;R234GDEQI3KHU;5;Por isso o livro nos ensina a identificar a deixa, que seria o gatilho da atividade, e reconhecer de fato o que nos faz seguirmos tal hábito e com isso combater os hábitos ruins, transformando esse loop.;1
6555871784;R2JS86E4O8M6A4;5;Pedir a Deus para não sofrer é como pedir para voar.;1
8580411971;R1VYWUJLZYOREH;5;Minha melhor aquisição, chegou dentro do prazo e o livro é maravilhoso!;2
8501112518;RHJXZPAFJXC95;5;Livro veio em ótimo estado e antes do prazo.;2
8501105732;R2ZWTQDIF1CRPP;5;A forma como tudo foi escrita, as amarrações feitas, os personagens, os timings.;1
8594541473;R3A4FCG75MSGGA;5;Chegou tudo certinho, livro muito interessante;2
6555871784;R1VR0V6U7VGZSM;5;Um ótima leitura.;0
8595084742;R2JYUJAUPYR4ZQ;5;Livro maravilhoso.. qualidade impecável.;0
8584391509;R1HAG20WO48IJ6;5;Ao relatar sua biografia, Evelyn revela tudo ao que foi exposta (abuso, preconceito), seus amores, suas dores, o que abriu mão, enfrentou, manipulou, mentiu, traiu e ousou durante sua trajetória de vida para realizar seu sonho de ser uma atriz famosa.;1
8595083274;R2QF2WU2TLUPO5;5;muito bom mesmo;0
8501112518;R1L0T82ILRB5JF;4;O livro é narrado por Lily e ,mesmo ficando intrigada em alguns momentos, não senti falta do POV de Ryle.;1
8501117846;RADSK5YSAAG3K;4;Se você, como eu é uma leitora dos livros da Coleen, vai ser uma surpresa quando terminar esse livro.;1
8535909559;R2R95FSSFYTSG5;5;Um livro que encabeça minha lista.;0
8568014003;R1DR6D1N8TCD1T;1;Juro que terminei o livro por honra ao valor que paguei por ele, pois digo que foi bem difícil termina-lo.;1
8576849941;RBXVOS9Z90SK8;5;Para quem gosta de ler recomendo ler esse livro e muito bom.;1
8555340896;RH0VDOO1PAEBL;5;Já virou meu romance favorito com toda certeza.;1
8543102146;R1F4YYI5JD06LE;3;O livro veio com defeito na página.;2
8595083274;R3HZRQQ8SDWO0K;5;Eu gostei muito do livro.;0
8595084742;R1I2AGRK35H1GQ;5;Livro lindo, chegou rápido e em perfeito estado.;2
8578601777;R26DZ73CE1R2IP;5;Excepcional, um verdadeiro clássico.;0
8535909559;R1YSJNOTAGMR2K;5;Recomendo esse e outras obras desse escritor!;0
8577876853;R3SQ6S8IVHPJBX;5;Consegui completar minha coleção.;0
8584391509;R3IJ7028DN8NHZ;5;Atrazou uns dias mas foi por erros com o endereço, fora isso chegou direitinho tudo certo.;2
8543107202;R3FMBNCMYM2SHW;5;Podemos aplicar os ensinamentos na vida de outros familiares e amigos.;1
8595083274;R31LHW8RWYAVN2;5;bem interessante;3
6580309318;R2IHXCJU0NVKR0;5;Livro ótimo com fontes e impressão que facilitam a leitura!;1
8501304468;RHT4OVBXSLR3H;5;O box está lindo demais e parece resistente, os brindes também são maravilhosos.;2
8576849941;RRU24MPYHI32K;5;Super recomendo;0
8584391509;RCR7CE0GU86LQ;5;Tenho muito a aprender com essa personagem!E claro, não posso deixar de falar de Monique.;1
8575422391;REB0JHHJEJYGF;1;Não gostei do livro, não achei útil;1
8575422391;R3M42B4H8APP88;5;As pessoas ricas assumem o compromisso de serem ricas.;1
8555341612;R1H4IRIDK7Z0JG;5;Quanto ao enredo, poder acompanhar os garotos aprendendo um pouquinho mais sobre seus próprios sentimentos e vivenciando novas experiências foi algo que me fez amar ainda mais a história, tornando eles um dos meus casais favoritos da literatura.;1
8501112518;R39441XJAXEGNZ;5;Melhor livro que li da autora, chorei horrores e demorei um tempo para me recuperar pisicologicamente!Que livro maravilhoso!;1
8565765695;R2URBHB4ZZ31BP;5;Se você é fã de fantasia, sugiro essa leitura!;1
8595084742;R2M8TT2U546RWJ;5;Vale a pena;0
8584391673;R31228Y75PHWOK;4;Apropósito, o Sam é personagem maravilhoso, deixou quentinho meu coração.;1
8594541473;R1QIKCFLOFEBC1;5;😍;3
6580309318;R10L0H4UWTDNUX;5;Gostei da forma crua realistica.;0
8565765482;R3F4UK2NUBBQVP;5;vale muito a pena ler;0
8582892101;R2DRHSFHNTFRJZ;5;Maravilhoso e didático!E ler e praticar!;0
8555340896;R1U2B0DXK9WXRV;5;super indico.;0
8584391509;RARTO96GUNKT9;3;Tem também.;3
6599039812;R1REQ0STN921NY;5;Eu comecei e terminei esse livro aos prantos diante da minha vulnerabilidade em exercer os dois papéis mais difíceis: ouvir e ser ouvida.;1
8551006754;R1YYQIAPP7A8QY;5;Ótima encadernação e impressão;2
8501117846;REM7KZ695L7U5;5;Lowen se sentir atraída por Jeremy desde o primeiro momento que seus olhos bateram nele.;1
8576082675;R3EN1W5VYXFQU8;5;se tu é ou quer ser programador come isso com farinha;1
8550802751;R17J0SJ2110WMH;4;Há cerca de 1 ano minha psicóloga recomendou-me este livro.;1
8574068012;R3NKOEK3XCPZ0G;5;rs;3
8542218752;R21ZKHS5ZWTMZC;4;Ter ensinamentos de pessoas mais experientes e que viveu coisas diferentes é sempre agregador.;1
8595083274;R3CAOTNCPWM6QF;5;Eu acompanho o canal do Primo Rico no YouTube desde 2015, sempre veio me ajudando como investi melhor e os conselhos do Thiago Nigro.;1
8535933921;R1LHJ9AVCEULFQ;5;Excelente!;0
8539004119;R2U6TR8ACBR1PJ;2;O milagre da manhã;3
6555320516;R2H03OE2L6APGU;5;A REALIDADE NO MUNDO ONDE VIVEMOS COMO AS PESSOAS;1
8551006754;R1NZFRJPWNPSQE;5;Edição maravilhosa, capa dura e chegou aqui em cada super rápido e sem danificar o livro;2
8576849941;RF4BLRNSKZODP;5;Mudou meus dias e minhas manhãs.;1
8535909559;R1D1J4XLMXU411;5;Excelente leitura, um clássico.;0
8555340896;RI7PZAAHLU5D7;3;não sei oq aconteceu, eu tirei o livro do plástico e a orelha estava solta, talvez tenha sido erro na hora da montagem e veio com esses resquícios de cola e papel no fundo;1
8595084742;R2LRI3U4UI6JZD;5;Super;3
8501112518;R55SA9P2KM19E;5;Sou apaixonada por essa escritora e não é atoa.;1
8542209826;R16RJA21JSL26B;5;Aventure-se!;0
8547000240;R1DLSZOUTHSDP3;5;Parabéns;3
8551006754;R2LT9S0099TEGM;5;Entrega super rápida e muito bem embalado.;2
8501117846;R3FZBV3REQST80;5;“O que você vai ler às vezes terá um gosto tão ruim que terá vontade de cuspir.;1
8595084742;R3TQBGBVVY2M5B;5;Tudo aqui vale a pena.;0
8584391509;R30H9QX9I10CPL;5;Evelyn lutou para se tornar Hugo.;1
8532606261;R27HP12I8VBILS;5;Recomendo;0
8535909559;R5WPBNWE23SAZ;5;A obra é sensacional , disso todos já sabem, o produto chegou em ótimo estado e antes do prazo.;2
6555111100;R2CEW67B5E10BS;5;recomendo;0
8576082675;R1R08N7NTCX67V;5;Muito bom, a capa é um pouco mais durinhas que aqueles livros de faculdade e a escrita do livro tenta não mudar o sentido que você teria lendo a obra original em inglês;1
8594541473;R1M3NEJZTINZU9;5;super recomendo...;0
8595084742;R1PR194LM9HMHK;5;O pôster é lindo e ficará super legal depois de emoldurado.;1
8535909559;R29NOBPV26BSC5;5;Muito bom...;0
8508196555;R30XLS8CDPWHUZ;5;Moysés quando via os judeus descalços e rotos orava pedindo a Deus para dar-lhe conforto e riquesa.;1
8565765482;R1SIV00BUCD7GW;4;Errei todos eles.;3
8542218752;R3PYNX9UDPFC12;5;leia com uma caneta na mão!!!!;1
8575422391;R1ZHMOD0CWON49;5;vai direto ao que interessa.;3
8595083274;RRN5SUH1OQ6AG;2;Considero este o público alvo desse livro, que possivelmente avaliará com mais estrelas.;1
8543105692;R3E8FIFE0L4ISG;5;Comprei sem muita expectativa, mas é uma leitura boa...;1
8551002341;R2FMIC1PD0GF8J;5;Não foi só a Lina que ficou apaixonada por ele 😩;1
8543107202;R39DYUFK922M4E;5;Traz muitas reflexões!!!;0
8501112518;R3PWXKFCEU2JOU;5;Vou lembrar dessa leitura pra sempre!;1
8501112518;R1YJUBLMLOMNGV;5;Gostei muito, eu me apaixonei, chorei, sorri, senti raiva e me vi na personagem lendo esse livro.;1
8532530788;R9J6CM5IRZXPK;5;Todos chegaram em perfeito estado, bem lacrado.;2
8578601777;R1JWFEKYT91CU4;5;Um belíssimo panorama de conceitos e dogmas do cristianismo expostos de forma clara, concisa, humorada e com uma forma de escrita que somente autores brilhantes conseguem fazer.;1
6599039812;R27ORW84R7N9LW;5;Recomendo.;0
8595083274;R2LR6EY7BLLTME;5;Ao final do livro ele te dá uma baita aula motivacional com relatos de experiências pessoais.;1
8555340896;R2FDOERFM5ZV2H;5;A entrega foi muito rápida e o livro vem em perfeito estado;2
8573258926;RWLX3L9QWTLLB;5;Nos explica as cinco linguagens do amor, como reconhecer.;1
8595084742;RVVEVH57B4KDG;5;Não sei se é algum erro na edição ou algo do tipo..;1
8542209826;R3HPSP1YWYFLLU;5;Estória forte de amor, de sonhos, de vida, de morte, de perdão e de muita muita muita emoção.;1
8575422391;R2TG4ABJIX1DJY;5;Muito bem embalado e bonitinho!;2
8584440739;R1MUM2FVFI7T6P;5;trás dicas muito boas para educação dos filhos;1
6555871784;R1AU6WU92IK47J;5;Cada palavra, frase foram milimetricamente encaixadas dentro do contexto de situações existenciais.;1
8580411971;R29ESPL0MN8GFL;5;Exatamente como anunciado.;3
8595081530;R2H4RVHYXAJGX1;5;Gostei muito das folhas e do tamanho.;0
8501112518;R2N7OZ7VQ8N3WS;3;Além de alguns amassados.;1
6555650001;R1EIBOXGEQ3M5P;3;a capa do livro veio com uma parte riscada.;1
8584391673;R2RG5O1JORAGD1;2;Como não tinha justificativa plausível para a Emma largar o marido a autora ficou jogando um shade pro Jesse o livro todo.;1
8532530788;R1TJFZOD1ZUNRJ;3;No entanto, esta edição é repleta de erros gramaticais, especialmente quanto ao uso de pronomes.;1
6580309318;R2IE94P0QWH2CK;5;Muito bom!;0
8501117684;RFEHD6QYNOFC4;5;Impossível não chorar!;0
8573258926;RKF9B0Y5LVEIQ;5;Gostei muito da forma como o tema é abordado.;1
8535933921;R3NJ9QONKEF5TC;5;Super;3
8574068012;R3TJYUVUGFE1QB;5;Quando você compra um livrinho desses, naturalmente, você está pensando na sua criança.;1
8595083274;R10525RN6SDRW;5;primo;3
8508196555;R3RJE9PIT2MA5G;5;Super indico;0
8532649963;R34IQG8Z6W195L;5;Chegou antes do prazo.;2
8565765695;RZL7HYVUGOB8M;5;Está um pouco marcado porq eu li antes de fazer a avaliação haha mas a capa dele é linda!;1
8535932879;R1G10PC8EM4NST;5;Todas as atividades e indagações, são pertinentes.;1
8539004119;R354V28S3W00IH;5;Adorei;0
8543104335;RF1BZ0C5O40L5;4;a leitura está sendo muito construtiva...;0
8565765695;R23F88D2D8AEIX;5;Gostei bastante mas veio riscada a capa o resto tá tudo;2
8580411971;R2X8LOL9S940K4;5;Sem palavras para essa história maravilhosa, esperando ansiosamente o lançamentos dos próximo livros na edição de luxo!;1
8595083274;R19NE8GXBJML3Y;5;Ótimo livro.;0
8595081530;R33QMQQWYN2F58;5;Você tem a alma de um escravo ou a alma de um homem livre?;1
8543107202;R1Z0EAI8D6477I;5;Ou para quem tem pais idosos.;1
8578601777;R3QCFQWID3ZFOM;5;Estou gostando muito da leitura, o escritor deixa bem claro suas intenções no início do livro.;1
6555111100;R3IBAIFJBPSIE2;5;Muito bom e uma abordagem diferenciada.;0
8551006754;R19J7ASERV7B8Y;5;Chegou em perfeito estado, muito bem embalado e sem danos.;2
8551002341;RDSEZWOY706CI;5;PERFEITOOOO.;0
8539004119;R2TZ3LB4JMW3UK;5;Duvida, então leia o livro, não tem como arrepender-se.;1
8550802751;R19LSRDN4PVVPD;5;Mesmo não me considerando tanto conservador como Jordan Peterson, o livro traz reflexões interessantes e que merecem considerações.;1
8532530788;R15EIS25P5LFY8;4;A autora retrata bem os personagens e o ambiente em que estão inseridos.;1
8575422391;R3OT1A024N7JGZ;5;Mostra uma perspectiva bem legal e de leitura muito fácil e agradável.;1
8594541473;R3S8KQMX6UM0P5;5;O livro é simplesmente lindo, por dentro e por fora.;1
8595083274;R1BA071RG77Z0G;5;O produto é maravilhoso, e Amazon presta um ótimo serviço, entrega surpreendentemente rápido.;2
6555650001;R3N5UNQ30ITY5S;4;O que me irritou um pouco foram as atitudes em relação as mulheres mas é compreensível visto que a época era diferente, outra sobressalta é a narração, achei que seria em primeira pessoa e me decepcionei quando vi que era narrador observador.;1
8535909559;RLV05GM85GIPZ;4;comentalivros.com;3
8595083274;RT4RMNTRATMO;5;Muito explicativo nas questões que não aprendemos na escola.;1
8535909559;R145050J9TFZH6;5;Veio perfeito e sem marcas;2
8535909559;R3423JLTPKU289;4;Material de boa qualidade e entrega rápida.;2
8575422391;R2HB8TD4DBPZQM;5;Me encheu de ideias de trabalho e de ações a serem tomadas.;1
8535932879;RI5VSD6AT2YGN;3;As letras são grandes e as folhas amareladas, o que facilita a leitura, a textura das folhas lembram a de jornais, mas com uma qualidade bem superior.;1
6580309318;R2ECETXE7Z9E52;4;“...;3
6555650842;R37EHLOGGZ37TC;5;Só tenho a dizer que Julia Quinn nunca decepciona, seus romances só melhoram a cada livro que ela escreve.;1
8595084742;RX2WK36OEEXDB;5;o livro é perfeitooo, vem bem embalado e chegou antes do prazo esperado;2
8535909559;R1JJBZMLO6Y0IQ;5;Muito inteligente.;3
8565765695;RQH2FVUIJCTBG;2;Infelizmente recebi o produto com a capa amassada.;2
8551002341;R3V9J55NZM7C1P;1;Comprei o livro pra presentear a minha filha, o mesmo chegou muito amassado.;2
8575422391;R1S0QZR796HEP0;5;Mudança de comportamento e hábitos para ter uma vida melhor em todos os sentidos.;1
8535909559;R9SPUWUO8CBGQ;5;Mas onde suas obras podem ser complicadas e cheias de sutilezas, está é simples e direta na sua mensagem: não siga cegamente, não confie nos líderes fanáticos, não se acomode com a revolução.;1
8535932879;R3G73JEGC8RNP1;5;Se possível, comprem e deem de presentes, num ato antirracista.;1
8584391673;R2CRTG99JAS1E1;5;Também mostra que somos como a água de um riacho, em constante mutação.;1
8542209826;R2FRP1AJUT7YU9;5;Recomendo a leitura muita rápida e empolgante.;0
8576849941;RNF3EOUT31XOF;5;Livro para nos fazer refletir, gostei bastante.;1
8584391401;R342PN9LDGTERI;5;E é aí que Taylor me fisgou!;1
8539004119;R15CE75FKXQLEN;5;Lí e recomendo a todos.;0
8565765482;RPXECOBIUCEJ;5;Amei e recomendo super!;0
8576849941;R3OFEZFCKNGKQO;5;Estou desde Julho de 2019 acordando as 4 da manhã e fazendo meu milagre da manhã!!;1
6555127279;R2IDSE74CVR6PY;5;Os personagens que podem incutir mistério e fascínio são ricamente explorados nesse volume, como o Yuuta e o Suguru Geto, que por sinal é o meu personagem favorito.;1
6555871784;R1B942WNCE98OF;5;Um dos melhores livros da atualidade.;0
6555650001;R1AD92AC9OJYQE;3;Para quem gosta de romance de época, imagino que tenha grandes chances de amar esse livro.;1
8578601777;R2HR3HQYMDJOY5;5;Que livro maravilhoso, amei 😍😍😍😍😍;0
8595084742;RN08NE2QK54OM;5;O livro tem uma escrita de fácil entendimento, creio eu, para a grande maioria que irá ler.;1
8578601777;RFX5QPDEQUEXY;5;Nesta obra prima, Lewis aborda questões fundamentais para os cristãos, bases da fé cristã, expondo de uma maneira que só ele sabia fazer, o livro é exímio e sempre é necessária uma nova leitura.;1
8576849941;R3FWQH61LWG1Q6;5;É um livro que me fez ir de uma pessoa improdutiva que dormia/acordava tarde, passava o dia todo reclamando da falta de tempo e de como eu não conseguia seguir em frente com o meu trabalho, para uma pessoa super produtiva que levanta 4 AM todos os dias, conclui diversas tarefas e faz o seu próprio tempo.;1
8543107202;R3S016MBNTAA9C;5;Adorei!;0
8595084742;R2WQLSRVXNF3PL;5;Para quem ainda tem dúvidas, vale muito a pena comprar e ter em casa essa história atemporal e clássica.;1
8595081530;R1ATSTUCZVZMOF;5;Sou da Bahia e chegou com 3 dias.;2
8575422391;R2H2C3H0DM50IG;5;Se trata mais de desaprender do que aprender.;1
6555650001;R2WIO9UOPDNN9;5;A história é muito divertida e bem escrita.;1
8532606261;R2L8T3U4IZZV2B;4;Apesar de ter sido escrito décadas atrás, mostra o funcionamento do ser humano de forma atual e com uma boa base teórica (logoterapia).;1
8543106591;R2AERB0A44DZKP;5;Que livro lindo e encantador!;0
8551006754;RBUK0R0GG4KJD;5;li este livro em um dia, pois não conseguia larga-lo por nada.;1
6555650842;RJ607ODB0536Q;5;Vale muito a pena.;0
8555340896;R3EXXM29MASZAA;5;Perfeito.;3
8578601777;R1P2XVHCCZPATE;5;Nenhum cristão de nossos dias deveria se dar ao luxo de ignorar este livro.;1
8501105732;R3540P0SE0QN2N;5;li pelo kindle e posso dizer que é perfeito tive que comprar o físico 💙;1
8580412382;R1H0QVVRNS93QT;5;Julia Quinn traz vida aos bailes e hábitos da época e ao mesmo tempo nos apresenta um original conto de fadas.;1
8568014542;R2DPSM9HT04T91;5;Acredito que tenho muito a aprender com essa leitura;1
8578601777;R1YYAT9WC666ZH;5;Capa dura de qualidade.;2
8580412382;R1PZMZWVQH7KJR;5;Recomendo a todos da Amazon;0
8543106591;R2VE8CBX1JAVIL;5;Lindo o livro!!!;0
8543107202;RQXMMSULTMN39;5;Nos faz refletir sobre muitas questões importantes da vida.;1
8573258926;R261GL6AU2VEX4;5;Livro de fácil leitura que pode salvar seu casamento ou namoro!;1
8555340896;R3RU8T61UM2TF;5;super rápido de ler o livro, e a qualidade e entrega foram ótimas!;2
8576849941;R1WKZOSOQA923Q;3;Bom, é a minha opinião;1
8543102146;R31NHB29CC31JL;5;Livro de leitura agradável sem repetições desnecessárias que a maioria dos livros costumam trazer.;1
8575422391;R1GOJEL0NP6HRV;5;EXCELENTE LIVRO, COM CERTEZA ABRINDO;1
8576849941;R3BNF1O852526S;4;Tudo perfeito.;3
8568014003;R24BKO8LZE95Y0;1;Não recomendo.;0
6555650842;R22ORYDER7SQTM;5;Adoro o humor presente no texto da Julia Quinn, e gosto como ela trabalha o desenvolvimento da história antes de partir para o romance.;1
6558380544;R133Q2YETRTM8P;1;O autor pegou a teoria dos universos paralelos e escreveu uma historinha.;1
8551006754;R2HYCNXIFCN78W;5;Amei o trabalho.;0
8580411971;R18XXDKK8AF3C8;4;de abelhas;3
8565765695;R3F0EFOOP8CJWP;5;o universo criado por Victoria Aveyard é com ctz algo valioso e que vale mt a pena o tempo gasto, uma leitura q te prende do inicio ao fim;1
8532649963;RF2UUAAZ19TV;3;Há críticas pertinentes ao atual  sistema, que insere economia em todos os aspectos da vida.;1
6555651059;RMCJOP1K9JYMJ;5;Gostei bastante!;0
8595083274;R1V0ENDESEB9GZ;5;Recomendo!!;0
8550802751;R1OE499TFY3Y8H;4;Por isso aconselha a não varrer a sujeira para debaixo do tapete (Regra 10).;1
8539004119;R1MHBTIEH7QBIX;5;Excelente livro!;0
8508196555;R25PO5CU8XV2XN;4;Como não estou acostumado com esse tipo de leitura( da forma que foi escrito ) acabo estranhando um pouco durante a leitura, mas é uma boa leitura.;1
8594541473;R37ILP2S94VDSB;5;Ótimo produto!;0
6555871784;R2U0R967I2QOF7;5;O livro te prende, faz com que você tente entender a personalidade, a emoção de cada personagem.;1
8535909559;R3A56LJ2V46PSZ;5;Não tem muito o que falar sobre Orwell, ele é genial.;1
8544106595;R3491F09Q3LYJF;5;É simplesmente lindo, o livro veio em perfeito estado, e chegou bem rápido também!;2
8542209826;R3L49CIP01AB7S;5;O livro estava perfeito, já estou lendo e amando!;1
8535932879;R16XENE8YOUPC2;3;no entanto, caso voce nao tenha a noção plena, a obra agrega muito valor.;1
8535909559;R3OA4898M7Y4WK;1;Vou solicitar a devolução.;2
8547000240;R2GCDF0EA7M7CN;3;Como ensinamento sobre as formas de pensar é muito bom, mesmo se para algumas ações não fica tão claro ou fácil compreender qual seria a forma correta de fazer.;1
8555340896;R2OGB6AO85IYAE;3;Algumas coisas são bem bobas e não funcionaram pra mim, mas é uma leitura legal;1
6580309318;R1TPWFA1EENZWU;5;Um relato importante para conscientizar a todos sobre as mazelas ainda existentes.;1
8584391401;R2XN2OXMH0RPWT;5;Texto perfeito apesar de despretensioso.;0
8578601777;R1TF86QREPPQJ5;5;Muito edificante!!;0
8595083274;R2CYBOC83YXDE6;2;Ele mistura um monte de coisa e não chega a lugar algum.;1
